{
  "bindings": [
    {
      "compatibility": "full",
      "isDefault": true,
      "sortOrder": 10,
      "voiceId": "Kore",
      "voiceKey": "google/Kore"
    },
    {
      "compatibility": "full",
      "sortOrder": 20,
      "voiceId": "Puck",
      "voiceKey": "google/Puck"
    },
    {
      "compatibility": "full",
      "sortOrder": 30,
      "voiceId": "Charon",
      "voiceKey": "google/Charon"
    },
    {
      "compatibility": "full",
      "sortOrder": 40,
      "voiceId": "Fenrir",
      "voiceKey": "google/Fenrir"
    },
    {
      "compatibility": "full",
      "sortOrder": 50,
      "voiceId": "Aoede",
      "voiceKey": "google/Aoede"
    },
    {
      "compatibility": "full",
      "sortOrder": 60,
      "voiceId": "Leda",
      "voiceKey": "google/Leda"
    },
    {
      "compatibility": "full",
      "sortOrder": 70,
      "voiceId": "Orus",
      "voiceKey": "google/Orus"
    },
    {
      "compatibility": "full",
      "sortOrder": 80,
      "voiceId": "Zephyr",
      "voiceKey": "google/Zephyr"
    }
  ],
  "catalogKey": "google/gemini-3.1-flash-tts-preview",
  "modelId": "gemini-3.1-flash-tts-preview",
  "regionCode": "global",
  "schemaVersion": "1.0.0",
  "source": {
    "observedAt": "2026-07-26T00:00:00Z",
    "sourceUrl": "https://ai.google.dev/gemini-api/docs/speech-generation"
  },
  "vendorCode": "google"
}
