{
  "schemaVersion": "1.0.0",
  "vendorCode": "elevenlabs",
  "regionCode": "global",
  "modelId": "eleven_flash_v2_5",
  "catalogKey": "elevenlabs/eleven_flash_v2_5",
  "bindings": [
    {
      "voiceKey": "elevenlabs/_catalog_dynamic",
      "voiceId": "_catalog_dynamic",
      "isDefault": true,
      "compatibility": "full",
      "sortOrder": 10,
      "notes": "Use any voice_id from the ElevenLabs voice library API."
    }
  ],
  "source": {
    "observedAt": "2026-07-03T00:00:00Z",
    "sourceUrl": "https://elevenlabs.io/docs/api-reference/text-to-speech"
  }
}
